{
    "document_data": {
        "refs3e": "",
        "size2e": "Small",
        "alignment2e": "Neutral",
        "refs2e": "",
        "size1e": "Small",
        "alignment1e": "Neutral",
        "refs1e": "",
        "patron deity": "",
        "movement": "Burrowing",
        "vision": "Low-light vision, Darkvision",
        "activecycle": "",
        "diet": "",
        "lifespan": "",
        "location": "",
        "language": "",
        "subraces": "",
        "climate": "Temperate",
        "terrain": "Forests",
        "height": "",
        "length": "",
        "wingspan": "",
        "weight": "",
        "skincolor": "",
        "haircolor": "",
        "hairstyles": "",
        "feathers": "",
        "eyecolor": "",
        "build": "",
        "distinctions": "",
        "based": "Badger",
        "first": "",
        "mainbody": "Badgers were a squat, furry species of mustelid.\nBadgers a distinctive white stripe from the tip of its long nose to the back of its head and white cheeks. They were a burrowing creature, considered to be experts at digging. \nBadgers were fierce fights and notorious for their fury when threatened. Despite its small size, when angered a badgers strong bite and sharp claws could be highly dangerous.\nGiant badger a rare variety that were twice the size of the standard badger, but largely the same in appearance.\nBadgers were typically encountered solitarily, unless they had a mate.\nIn the Unapproachable East, badgers could be found in the Tannath Gap, Yuirwood, and Ashenwood.\nIn Kara-Tur they could be found in its temperate plains and forests, tropical forests, and steppelands.\nBadgers were admired by the gnome race and could often be seen serving as \"watchdogs\" for rock gnome homes. \nBadgers were a favored animal of the deities Garl Glittergold, Geb, Rillifane Rallathil, Sheela Peryroyl, Silvanus, and Tempus. They often chose these beasts to act as symbols of their favor to their followers.\nSome creatures were known to hunt badgers for the pelts. These typically fetched prices of around 10 to 30 gold pieces.\n* Some Ysgardian dwarves could assume the form of a badger.\n* A badger could be summoned by the conjure animals spell."
    }
}